{
  "experiment_id": "phase3_deepseek-v4-pro_L04",
  "model": {
    "provider": "openrouter",
    "slug": "deepseek/deepseek-v4-pro",
    "params": {
      "temperature": 0.7,
      "top_p": 0.8
    },
    "thinking_mode": false
  },
  "corpus": {
    "subset": [
      "10.1007_s10953-014-0169-0",
      "10.1007_s10953-019-00861-7",
      "10.1016_j.cjche.2014.03.006",
      "10.1016_j.cjche.2018.11.005",
      "10.1016_j.cjche.2020.10.037",
      "10.1016_j.fluid.2015.07.032",
      "10.1016_j.jct.2014.05.005",
      "10.1016_j.jct.2015.10.016",
      "10.1016_j.jct.2016.07.048",
      "10.1016_j.jct.2017.07.023",
      "10.1016_j.jct.2022.106934",
      "10.1016_j.jct.2023.107064",
      "10.1016_j.jct.2023.107202",
      "10.1016_j.jct.2023.107231",
      "10.1016_j.molliq.2013.07.014",
      "10.1016_j.molliq.2014.12.040",
      "10.1016_j.molliq.2016.03.021",
      "10.1016_j.molliq.2016.07.007",
      "10.1016_j.molliq.2018.02.068",
      "10.1016_j.molliq.2018.07.019",
      "10.1016_j.molliq.2018.10.109",
      "10.1016_j.molliq.2020.114671",
      "10.1016_j.molliq.2020.115095",
      "10.1016_j.molliq.2021.116233",
      "10.1016_j.molliq.2021.118057",
      "10.1016_j.molliq.2023.121532",
      "10.1021_acs.jced.0c00506",
      "10.1021_acs.jced.0c00633",
      "10.1021_acs.jced.1c00247",
      "10.1021_acs.jced.1c00385",
      "10.1021_acs.jced.1c00485",
      "10.1021_acs.jced.1c00672",
      "10.1021_acs.jced.2c00133",
      "10.1021_acs.jced.3c00129",
      "10.1021_acs.jced.3c00146",
      "10.1021_acs.jced.3c00349",
      "10.1021_acs.jced.3c00364",
      "10.1021_acs.jced.7b00468",
      "10.1021_acs.jced.9b01020",
      "10.1021_je1006289",
      "10.1021_je400053q",
      "10.1021_je4005992",
      "10.1021_je401044h",
      "10.1021_je500744k",
      "10.1021_je501026m",
      "10.1021_je501173n",
      "10.1021_je800120p",
      "10.1021_je900646u",
      "10.1021_je901024t"
    ]
  },
  "prompt": "prompts/cumulative_deepseek-v4-pro_L04.md",
  "seeds": [
    42,
    7,
    123
  ]
}
